url,name,MaSanPham,author,NXB,NgayPhatHanh,kichthuoc,sotrang,gioithieu,giatien
http://nhanam.com.vn/sach/4011/the-gioi-rau-cu-qua-bang-tranh,Thế giới rau củ quả bằng tranh ,8935235210707,Virginie Aladjidi - Emmanuelle.,Thế Giới,Ngày phát hành: 14-01-2017,"Kích thước: 20,5 x 28,5",Số trang: 78,"Một cuốn cẩm nang được minh họa với những sắc màu phong phú và vui mắt, giới thiệu với bạn đọc các loài rau củ quả đến từ khắp nơi trên thế giới, dù lạ lẫm hay quen thuộc, dù mọc ngầm trong đất hay leo trên giàn cao, dù đơm hoa vào mùa hè hay kết trái vào mùa đông… Trên tinh thần của các nhà vạn vật học cách đây nhiều thế kỷ, Emmanuelle Tchoukriel đã tái tạo một cách chính xác sự đa dạng về hình dáng, màu sắc và cấu tạo của hơn 80 loài rau củ quả, kèm theo đó là những thông tin khoa học đơn giản và dễ hiểu ",95.000đ
http://nhanam.com.vn/sach/1894/nhung-bai-toan-do-matxcova,Những bài toán đố Mátxcơva,8935235210240,Boris A.Kordemsky,Thế Giới,Ngày phát hành: 07-10-2016,Kích thước: 15 x 24 cm ,Số trang: 384, ,108.000đ
http://nhanam.com.vn/sach/1890/trai-hay-gai-chung-minh-chang-khac-nhau-bo-sa,Trai hay gái chúng mình chẳng khác nhau (Bộ sách an toàn cho con yêu),8935235210325,Jayneen Sanders - Amanda Gulliver,Hội nhà văn,Ngày phát hành: 06-10-2016,Kích thước: 19 x 25 cm,Số trang: 30, ,38.000đ
http://nhanam.com.vn/sach/1905/truoc-sau---thang-ngay-va-doi-thay,Trước sau - tháng ngày và đổi thay,8935235209909,Anne-Margot Ramstein & Matthias Aregui,Hội nhà văn,Ngày phát hành: 08-10-2016,Kích thước: 17 x 25 cm,Số trang: 176,Đừng thất vọng nếu bạn không tìm thấy dòng chữ nào trong cuốn sách này!,108.000đ
http://nhanam.com.vn/sach/2940/ha-noi-mot-thoi,Hà Nội một thời ,8935235210394,John Ramsden,Thế Giới,Ngày phát hành: 02-12-2016,Kích thước: 27 x 27 cm,Số trang: 163,- Chiết khấu 25% ,150.000đ
http://nhanam.com.vn/sach/2955/chuyen-cua-dat-set,Chuyện của đất sét ,8935235210639,Nhain.vn,Hội nhà văn,Ngày phát hành: 08-12-2016,"Kích thước: 15,5 x 21 cm ",Số trang: 135,"Trò chơi nặn đất sét hay nặn những bức tượng Tò he là một thú vui sáng tạo và quen thuộc với nhiều bạn nhỏ Việt Nam. Hiện nay, với sự du nhập của một loại đất sét bắt nguồn từ Nhật Bản, có khả năng tự khô trong không khí, khi khô thì cứng lại như nhựa, trò chơi nặn đất đã được nâng tầm với nhiều ứng dụng phong phú, làm say mê trẻ con mà cả các bạn thanh thiếu niên và người lớn. Bạn có thể tự làm cho mình các đồ trang trí trong nhà như móc chìa khóa, kẹp sách, đồ trang sức...",58.000đ
http://nhanam.com.vn/sach/2952/truyen-cuoi-dan-gian-viet-nam,Truyện cười dân gian Việt Nam ,8935235210530,Nhiều tác giả,Văn học,Ngày phát hành: 14-12-2016,"Kích thước: 14 x 20,5 ",Số trang: 190,"Cùng với tục ngữ, ca dao, dân ca, cổ tích, thần thoại..., truyện cười dân gian, cũng còn gọi là ",79.000đ
http://nhanam.com.vn/sach/3975/canh-chim-trong-gio,Cánh chim trong gió,8935235210721,Lê Hồng Lâm,Hội nhà văn,Ngày phát hành: 26-12-2016,"Kích thước: 14 x 20,5 ",Số trang: 292,"Điện ảnh là niềm đam mê của Lê Hồng Lâm. Tuy nhiên, trong cuốn sách này, điện ảnh là tấm gương mà qua đó Lê Hồng Lâm nhìn và nghĩ về thế giới. Câu chuyện điện ảnh mà anh dẫn chúng ta vào, đó không chỉ là câu chuyện về những bộ phim và các nhà làm phim cùng những thành công và thất bại của chúng, những vẻ đẹp và chiều sâu của chúng: đó còn là câu chuyện về xã hội và bản chất con người.",80.000đ
